name_static,context_static,governance_static,aggression_static,willingness to use force_static,distance to purple_static,distance to white_static,distance to pink_static,distance to red_static,distance to yellow_static,distance to blue_static,distance to green_static,distance_to_orange_static,territory_dynamic,military capacity_dynamic,gdp_dynamic,trade_dynamic,resources_dynamic,political stability_dynamic,population_dynamic,soft power_dynamic,cybersecurity_dynamic,nuclear_dynamic
Purple,"Purple aims to bolster its international presence by promoting peace, its core values, and the prosperity of its member states while focusing on shared global challenges like climate change.",Democratic,2,6,1,4,10,10,8,8,10,2,5,6,37.6,10,10,10,447,10,10,0
White,White is striving to redefine its global standing by fostering diplomatic and trade relations based on its historical influence and commitment to international law.,Democratic,4,6,4,1,10,10,8,8,10,3,2,6,6,10,8,10,67,10,10,10
Pink,"Pink's foreign policy revolves around its quest for international recognition and the need to strengthen its diplomatic ties. Pink seeks trade, technological, and cultural exchanges while navigating the delicate balance of global geopolitics.",Democratic,2,4,10,10,1,2,6,10,10,7,1,4,2.6,8,6,8,23.5,8,8,0
Red,"As a global superpower, Red's ambition is to solidify its international influence, prioritize economic growth, and increase its territory.",Authoritarian,6,10,10,10,2,1,4,10,10,2,6,10,34,10,10,10,1400,6,10,10
Yellow,"With its principle of non-alignment and peaceful coexistence, Yellow endeavors to amplify its voice in global forums, drawing on its cultural richness and strategic importance.",Democratic,4,6,8,8,6,4,1,10,10,4,3,7,20,8,8,8,1380,6,8,10
Blue,"Blue, in upholding its global leadership role, champions the spread of democracy, human rights, and international security.",Democratic,8,10,8,8,10,10,10,1,6,8,7,10,42,10,10,10,332,10,10,10
Green,"Positioned as a leading voice on their continent, Green emphasizes regional unity while forging global alliances to drive development and trade. Even as it largely avoids direct conflicts, Its stance underscores principles like non-intervention and peaceful resolution of disputes, ensuring a balanced approach to global diplomacy, while at the same time aiming to strenghten its power on it's continent.",Democratic,2,6,10,10,10,10,10,6,1,10,3,6,6.2,8,6,8,213,6,6,0
Orange,"Orange's foreign policy goals are centered on restoring its stature as a dominant global player, safeguarding its borders, and expanding its geopolitical influence. It wants to expand its territory to its historic borders by all available means, including military interventions and at the expense of deteriorating relations with other countries. Orange also does not respect the independence and border integrity of other countries.",Authoritarian,10,10,2,3,7,2,4,8,10,1,7,6,10,6,6,6,143,5,7,10